{
  "schema_version": "1",
  "document_type": "DRA_SIGNAL_CONFIRMATION_LATENCY_ENTRY_ADMISSION_MANIFEST_V1",
  "experiment_id": "dra-signal-confirmation-latency-entry-admission-historical-v1",
  "hypothesis_id": "dra-signal-confirmation-latency-entry-admission-v1",
  "authorization": "RESEARCH_ONLY_NOT_SHADOW_PAPER_OR_LIVE",
  "parent_strategy": "BTC_DRA_V1_BASELINE_250_USDT_FIXED_30_USDT_LOTS",
  "gate_set": "DRA_SIGNAL_CONFIRMATION_LATENCY_ENTRY_ADMISSION_ECONOMIC_GATES_V1",
  "oos_access": "DENY",
  "dataset": {
    "path": ".research-state/java-parity/selection-2019-2024.tsv",
    "canonical_sha256": "e436a5a2b093365886464dd3e471cc5cd55c54bd2c06ceaa898ac218c45436dd",
    "rows": 52608,
    "selection_cutoff": "2025-01-01T00:00:00"
  },
  "economics": {
    "initial_equity_usdt": "250",
    "maximum_open_cost_usdt": "240",
    "maximum_open_lots": 8,
    "lot_cost_usdt": "30",
    "fee_rate_each_side": "0.0010",
    "adverse_slippage_rate_each_side": "0.0005",
    "fill": "UNCHANGED_NEXT_H1_OPEN",
    "exit": "UNCHANGED_DRA_V1_PROFIT_ONLY_5PCT_NET_ESTIMATE"
  },
  "mechanism": {
    "decision_clock": "UNCHANGED_DRA_SIGNAL_BEFORE_NEXT_H1_OPEN",
    "capacity_first": true,
    "latency_clock": "SIGNAL_TIME_MINUS_CURRENT_PARENT_ARMED_AT_IN_HOURS",
    "relation": "VETO_AT_OR_ABOVE_THRESHOLD_HOURS",
    "veto_reserves_cooldown": "SEVEN_DAYS_FROM_ORIGINAL_SIGNAL",
    "armed_window_expiry_and_rearm": "UNCHANGED_PARENT_THIRTY_DAY_LIFECYCLE",
    "capacity_block": "UNCHANGED_PARENT_BLOCK_WITHOUT_COOLDOWN_RESERVATION",
    "price_or_inventory_state_read": "DENY",
    "sell_or_resize_existing_lots": "DENY"
  },
  "variants": [
    {
      "role": "lower_threshold_neighbor",
      "threshold_hours": "72",
      "variant_id": "armed-to-signal-latency-at-least-72h-v1"
    },
    {
      "role": "primary",
      "threshold_hours": "168",
      "variant_id": "armed-to-signal-latency-at-least-168h-v1"
    },
    {
      "role": "upper_threshold_neighbor",
      "threshold_hours": "336",
      "variant_id": "armed-to-signal-latency-at-least-336h-v1"
    }
  ],
  "gate_contract": {
    "primary_all_required": [
      "all_action_accounting_reconciles",
      "design_total_pnl_improves",
      "validation_total_pnl_improves",
      "design_realized_pnl_improves",
      "validation_realized_pnl_improves",
      "validation_unrealized_non_worse",
      "design_risk_adjusted_score_improves",
      "validation_risk_adjusted_score_improves",
      "design_drawdown_within_0_25pp",
      "validation_drawdown_within_0_25pp",
      "design_max_underwater_duration_non_worse",
      "validation_max_underwater_duration_non_worse",
      "validation_median_hold_non_worse",
      "validation_p90_hold_non_worse",
      "design_terminal_inventory_count_non_worse",
      "validation_terminal_inventory_count_non_worse",
      "validation_terminal_inventory_cost_non_worse",
      "validation_terminal_unrealized_non_worse",
      "design_interventions_at_least_8",
      "validation_interventions_at_least_4",
      "annual_total_wins_at_least_3_of_5",
      "annual_drawdown_non_worse_at_least_4_of_5",
      "annual_risk_adjusted_wins_at_least_3_of_5",
      "top_year_positive_delta_contribution_at_most_60pct"
    ],
    "each_neighbor_all_required": [
      "action_accounting_reconciles",
      "validation_total_pnl_non_worse",
      "validation_realized_non_worse",
      "validation_risk_adjusted_score_non_worse",
      "validation_drawdown_within_0_25pp",
      "validation_max_underwater_duration_non_worse",
      "validation_terminal_inventory_count_non_worse",
      "validation_interventions_at_least_4"
    ],
    "drawdown_tolerance_percentage_points": "0.25",
    "failure_disposition": "NO_CANDIDATE_PERMANENTLY_CLOSE_DRA_SIGNAL_CONFIRMATION_LATENCY_FAMILY",
    "pass_disposition": "CANDIDATE_FROZEN_REPORTED_NOT_ACTIVATED"
  },
  "forbidden_rescue_actions": [
    "THRESHOLD_TUNING_AFTER_OUTCOME",
    "ARMED_OR_SIGNAL_CLOCK_TUNING_AFTER_OUTCOME",
    "ARM_WINDOW_EXPIRY_OR_REARM_TUNING_AFTER_OUTCOME",
    "COOLDOWN_OR_CAPACITY_ROUTE_TUNING_AFTER_OUTCOME",
    "PRICE_INVENTORY_OR_PNL_AWARE_DECISION_FILTER_AFTER_OUTCOME",
    "GATE_RELAXATION_AFTER_OUTCOME",
    "OOS_ACCESS_DURING_HISTORICAL_SCREEN",
    "FAMILY_REOPEN_AFTER_FAILED_FROZEN_SCREEN"
  ],
  "hypothesis_binding": {
    "path": "research_pipeline/examples/dra-signal-confirmation-latency-entry-admission-v1.hypothesis.json",
    "sha256": "99c1f6a2eb90220c5897e43e316bf5871d40f545d0c3a94f4c4f3b3a256d31ae"
  },
  "prior_evidence": {
    "path": "research_pipeline/examples/dra-signal-confirmation-latency-entry-admission-preoutcome.v1.acceptance.json",
    "sha256": "2828d66bfc077aeaa728ad8bf101e8d242088224e8df2a2f3df8362de8017923"
  },
  "runner_binding": {
    "path": "research/btc_dra_signal_confirmation_latency_entry_admission_v1.py",
    "sha256": "6f720b0b0310876e2f4aec51ba242d715b0e4ff20aed90bc1477713b35bab4c2"
  },
  "support_runner_binding": {
    "path": "research/dra_signal_confirmation_latency_support_v1.py",
    "sha256": "dad48c65528981c655d62e3ecdfe5c4e9033ec53e4ca7d2825488770e01d9873"
  },
  "economic_gate_helper_binding": {
    "path": "research/btc_dra_stale_inventory_age_entry_admission_v1.py",
    "sha256": "45d32cc379af6a9a5dd47575eb0362cc399c464e8c88ba0c22de9a79bb6eee29"
  }
}
